<?xml version="1.0" encoding="utf-8"?>
<Root xmlns="OrientalEmpires"
xmlns:xsi = "http://www.w3.org/2001/XMLSchema-instance"
       xsi:schemaLocation ="OrientalEmpires Settlements.xsd">

 <!-- Architecture can be specified for 
 SlotProxy, GeneralProxy and WallProxy
 -->
  
  <!--  Architectures must be declared first -->
  <Architecture ID ="Central Asian"/>

  <!-- Central Asia people -->
  <AmbientProxy Prefab="OE_CivilianCAPoorIdle_Proxy">
    <Item Item="M Peasant CA Standing" Weight="1"/>
    <Item Item="F Peasant CA Standing" Weight="1"/>
  </AmbientProxy>

<!-- Settlement Bases////////////////////////////////////////////////////////////// -->

  <SettlementBase ID ="Base128_Flat" Prefab="Architecture/Settlement_Terrain/Exports/OE_TerrainChinese_128x128_Flat01">
    <Mask Material="Architecture/Terrain_Masks/Materials/OE_Settlement_128Flat_Mask"/>
    <Road>
      <Texture Name="Architecture/Settlement_Terrain/Textures/Northern_China/OE_SettlementTerrain_Cobbles_diff" Climate="Default"/>
      <Texture Name="Architecture/Settlement_Terrain/Textures/Northern_China/OE_SettlementTerrain_Cobbles_diff" Climate="Southern China" Seasonal ="false"/>
      <Texture Name="Architecture/Settlement_Terrain/Textures/Northern_China/OE_SettlementTerrain_Cobbles_diff" Climate="Gobi Desert" Seasonal ="false"/>
      <Texture Name="Architecture/Settlement_Terrain/Textures/Northern_China/OE_SettlementTerrain_Cobbles_diff" Climate="Central Asia DLC" Seasonal ="false"/>
    </Road>
    <Dirt>
      <Texture Name="Architecture/Settlement_Terrain/Textures/Northern_China/OE_SettlementTerrain_Dirt_diff" Climate="Default"/>
      <Texture Name="Architecture/Settlement_Terrain/Textures/Northern_China/OE_SettlementTerrain_Dirt_diff" Climate="Southern China" Seasonal ="false"/>
      <Texture Name="Architecture/Settlement_Terrain/Textures/Northern_China/OE_SettlementTerrain_Dirt_diff" Climate="Gobi Desert" Seasonal="false"/>
      <Texture Name="Architecture/Settlement_Terrain/Textures/Northern_China/OE_SettlementTerrain_Dirt_diff" Climate="Central Asia DLC" Seasonal="false"/>
    </Dirt>
    <Mud>
      <Texture Name="Architecture/Settlement_Terrain/Textures/Northern_China/OE_SettlementTerrain_Mud_diff" Climate="Default"/>
      <Texture Name="Architecture/Settlement_Terrain/Textures/Northern_China/OE_SettlementTerrain_Mud_diff" Climate="Southern China" Seasonal ="false"/>
      <Texture Name="Architecture/Settlement_Terrain/Textures/Northern_China/OE_SettlementTerrain_Mud_diff" Climate="Gobi Desert" Seasonal="false"/>
      <Texture Name="Architecture/Settlement_Terrain/Textures/Northern_China/OE_SettlementTerrain_Mud_diff" Climate="Central Asia DLC" Seasonal="false"/>
    </Mud>
  </SettlementBase>
  <SettlementBase ID ="Base128_Flat_NoWalls" Prefab="Architecture/Settlement_Terrain/Exports/OE_TerrainChinese_128x128_Flat01">
    <Mask Material="Architecture/Terrain_Masks/Materials/OE_Settlement_128Flat_NoWalls_Mask"/>
    <Road>
      <Texture Name="Architecture/Settlement_Terrain/Textures/Northern_China/OE_SettlementTerrain_Mud_diff" Climate="Default"/>
    </Road>
    <Dirt>
      <Texture Name="Architecture/Settlement_Terrain/Textures/Northern_China/OE_SettlementTerrain_Base_diff" Climate="Default"/>
    </Dirt>
    <Mud>
      <Texture Name="Architecture/Settlement_Terrain/Textures/Northern_China/OE_SettlementTerrain_Mud_diff" Climate="Default"/>
    </Mud>
  </SettlementBase>
  
  <SettlementBase ID ="Base128_Moat" Prefab="Architecture/Settlement_Terrain/Exports/OE_TerrainChinese_128x128_Moat01">
    <Mask Material="Architecture/Terrain_Masks/Materials/OE_Settlement_128Moat_Mask"/>
    <Road>
      <Texture Name="Architecture/Settlement_Terrain/Textures/Northern_China/OE_SettlementTerrain_Cobbles_diff" Climate="Default"/>
      <Texture Name="Architecture/Settlement_Terrain/Textures/Northern_China/OE_SettlementTerrain_Cobbles_diff" Climate="Southern China" Seasonal ="false"/>
      <Texture Name="Architecture/Settlement_Terrain/Textures/Northern_China/OE_SettlementTerrain_Cobbles_diff" Climate="Gobi Desert" Seasonal ="false"/>
      <Texture Name="Architecture/Settlement_Terrain/Textures/Northern_China/OE_SettlementTerrain_Cobbles_diff" Climate="Central Asia DLC" Seasonal ="false"/>
    </Road>
    <Dirt>
      <Texture Name="Architecture/Settlement_Terrain/Textures/Northern_China/OE_SettlementTerrain_Dirt_diff" Climate="Default"/>
      <Texture Name="Architecture/Settlement_Terrain/Textures/Northern_China/OE_SettlementTerrain_Dirt_diff" Climate="Southern China" Seasonal ="false"/>
      <Texture Name="Architecture/Settlement_Terrain/Textures/Northern_China/OE_SettlementTerrain_Dirt_diff" Climate="Gobi Desert" Seasonal="false"/>
      <Texture Name="Architecture/Settlement_Terrain/Textures/Northern_China/OE_SettlementTerrain_Dirt_diff" Climate="Central Asia DLC" Seasonal="false"/>
    </Dirt>
    <Mud>
      <Texture Name="Architecture/Settlement_Terrain/Textures/Northern_China/OE_SettlementTerrain_Mud_diff" Climate="Default"/>
      <Texture Name="Architecture/Settlement_Terrain/Textures/Northern_China/OE_SettlementTerrain_Mud_diff" Climate="Southern China" Seasonal ="false"/>
      <Texture Name="Architecture/Settlement_Terrain/Textures/Northern_China/OE_SettlementTerrain_Mud_diff" Climate="Gobi Desert" Seasonal="false"/>
      <Texture Name="Architecture/Settlement_Terrain/Textures/Northern_China/OE_SettlementTerrain_Mud_diff" Climate="Central Asia DLC" Seasonal="false"/>
    </Mud>
  </SettlementBase>
  <SettlementBase ID ="Base160_Flat" Prefab="Architecture/Settlement_Terrain/Exports/OE_TerrainChinese_160x160_Flat01">
    <Mask Material="Architecture/Terrain_Masks/Materials/OE_Settlement_160Flat_Mask"/>
    <Road>
      <Texture Name="Architecture/Settlement_Terrain/Textures/Central_Asia/OE_SettlementTerrain_CentralAsia_Cobbles_diff" Climate="Default"/>
    </Road>
    <Dirt>
      <Texture Name="Architecture/Settlement_Terrain/Textures/Central_Asia/OE_SettlementTerrain_CentralAsia_Dirt_diff" Climate="Default"/>
    </Dirt>
    <Mud>
      <Texture Name="Architecture/Settlement_Terrain/Textures/Northern_China/OE_SettlementTerrain_Mud_diff" Climate="Default"/>
    </Mud>
  </SettlementBase>
  <SettlementBase ID ="Base160_Flat_NoWalls" Prefab="Architecture/Settlement_Terrain/Exports/OE_TerrainChinese_160x160_Flat01">
    <Mask Material="Architecture/Terrain_Masks/Materials/OE_Settlement_160Flat_NoWalls_Mask"/>
    <Road>
      <Texture Name="Architecture/Settlement_Terrain/Textures/Central_Asia/OE_SettlementTerrain_CentralAsia_Cobbles_diff" Climate="Default"/>
    </Road>
    <Dirt>
      <Texture Name="Architecture/Settlement_Terrain/Textures/Central_Asia/OE_SettlementTerrain_CentralAsia_Dirt_diff" Climate="Default"/>
    </Dirt>
    <Mud>
      <Texture Name="Architecture/Settlement_Terrain/Textures/Central_Asia/OE_SettlementTerrain_CentralAsia_Dirt_diff" Climate="Default"/>
    </Mud>
  </SettlementBase>
  
  <SettlementBase ID ="Base160_Moat" Prefab="Architecture/Settlement_Terrain/Exports/OE_TerrainChinese_160x160_Moat01">
    <Mask Material="Architecture/Terrain_Masks/Materials/OE_Settlement_160Moat_Mask"/>
    <Road>
      <Texture Name="Architecture/Settlement_Terrain/Textures/Central_Asia/OE_SettlementTerrain_CentralAsia_Cobbles_diff" Climate="Default"/>
    </Road>
    <Dirt>
      <Texture Name="Architecture/Settlement_Terrain/Textures/Central_Asia/OE_SettlementTerrain_CentralAsia_Dirt_diff" Climate="Default"/>
    </Dirt>
    <Mud>
      <Texture Name="Architecture/Settlement_Terrain/Textures/Northern_China/OE_SettlementTerrain_Mud_diff" Climate="Default"/>
    </Mud>
  </SettlementBase>
  <SettlementBase ID ="Base64_Flat" Prefab="Architecture/Settlement_Terrain/Exports/OE_TerrainChinese_96x96_Flat01">
    <Mask Material="Architecture/Terrain_Masks/Materials/OE_Settlement_64Flat_Mask"/>
    <Road>
      <Texture Name="Architecture/Settlement_Terrain/Textures/Central_Asia/OE_SettlementTerrain_CentralAsia_Cobbles_diff" Climate="Default"/>
    </Road>
    <Dirt>
      <Texture Name="Architecture/Settlement_Terrain/Textures/Central_Asia/OE_SettlementTerrain_CentralAsia_Dirt_diff" Climate="Default"/>
    </Dirt>
    <Mud>
      <Texture Name="Architecture/Settlement_Terrain/Textures/Northern_China/OE_SettlementTerrain_Mud_diff" Climate="Default"/>
    </Mud>
  </SettlementBase>
	<SettlementBase ID ="Base64_Flat_NoWalls" Prefab="Architecture/Settlement_Terrain/Exports/OE_TerrainChinese_96x96_Flat01">
    <Mask Material="Architecture/Terrain_Masks/Materials/OE_Settlement_64Flat_NoWalls_Mask"/>
    <Road>
      <Texture Name="Architecture/Settlement_Terrain/Textures/Central_Asia/OE_SettlementTerrain_CentralAsia_Cobbles_diff" Climate="Default"/>
    </Road>
    <Dirt>
      <Texture Name="Architecture/Settlement_Terrain/Textures/Central_Asia/OE_SettlementTerrain_CentralAsia_Dirt_diff" Climate="Default"/>
    </Dirt>
    <Mud>
      <Texture Name="Architecture/Settlement_Terrain/Textures/Northern_China/OE_SettlementTerrain_Mud_diff" Climate="Default"/>
    </Mud>
  </SettlementBase>
  
  <SettlementBase ID ="Base64_Moat" Prefab="Architecture/Settlement_Terrain/Exports/OE_TerrainChinese_96x96_Moat01">
    <Mask Material="Architecture/Terrain_Masks/Materials/OE_Settlement_64Moat_Mask"/>
    <Road>
      <Texture Name="Architecture/Settlement_Terrain/Textures/Central_Asia/OE_SettlementTerrain_CentralAsia_Cobbles_diff" Climate="Default"/>
    </Road>
    <Dirt>
      <Texture Name="Architecture/Settlement_Terrain/Textures/Central_Asia/OE_SettlementTerrain_CentralAsia_Dirt_diff" Climate="Default"/>
    </Dirt>
    <Mud>
      <Texture Name="Architecture/Settlement_Terrain/Textures/Northern_China/OE_SettlementTerrain_Mud_diff" Climate="Default"/>
    </Mud>
  </SettlementBase>
  
  <!-- Wall Proxies ///////////////////////////////////////////////////////////////////-->
  <WallProxy Prefab="OE_WallBrick_3m_Straight_Lvl1" PieceType="Wall">